Question,Answer,Name
"careō, carēre, caruī, caritūrum","+ abl. of speration, to be without, be deprived of, want, lack; be free from","careō, carēre, caruī, caritūrum"
"dēfendō, dēfendere, dēfendī, dēfēnsum","to ward offl defend, protect","dēfendō, dēfendere, dēfendī, dēfēnsum"
"discēdō, discēdere, discessī, discessum","to go away, depart","discēdō, discēdere, discessī, discessum"
"ōdī, ōdisse, ōsum","a defective verb having perf. system forms with pres. force, to hate","ōdī, ōdisse, ōsum"
"prohibeō, prohibēre, prohibuī, prohibitum","to keep (back), prevent, hinder, restrain, prohibit","prohibeō, prohibēre, prohibuī, prohibitum"
"prōnūntiō, prōnūntiāre, prōnūntiāvī, prōnūntitātum","to proclaim, announce; declaim; pronounce","prōnūntiō, prōnūntiāre, prōnūntiāvī, prōnūntitātum""prōnūntiō, prōnūntiāre, prōnūntiāvī, prōnūntitātum"
"contineō, continēre, continuī, contentum","to hold togehter, contain, keep, enclose, restrain","contineō, continēre, continuī, contentum"
"labōrō, labōrāre, labōrāvī, labōrātum","to labor; be in distress","labōrō, labōrāre, labōrāvī, labōrātum"
"tangō, tangere, tetigī, tāctum","to touch","tangō, tangere, tetigī, tāctum"